<?xml version="1.0" encoding="UTF-8"?>
<!DOCTYPE sport_shop SYSTEM "sport_shop.dtd">
<sport_shop>
  <shop_info shop_id="N1">
    <shop_name>Сила</shop_name>
    <country>България</country>
    <city>София</city>
    <address>Георги С. Раковски 176</address>
    <phone>0876142563</phone>
    <email>sila@gmail.com</email>
    <site>www.sila.com</site>
  </shop_info>
  <supplements>
    <supplement supplement_id="15"  type="Протеини" purpose="Изграждане на чисти мускули"  supplement_brand="Oптимум нутришън" available_in_shop="N1">
      <supplement_name>Комплете</supplement_name>
      <supplement_price currency="лев">102.00</supplement_price>
      <supplement_rating>8</supplement_rating>
      <taste>шоколад</taste>
      <packing measurement_unit="кг">2.225</packing>
      <servings>22 дози</servings>
    </supplement>
    <supplement supplement_id="16"  type="Аминокиселини" purpose="Изгаряне на мазнини"  supplement_brand="Универсал" available_in_shop="N1">
      <supplement_name>Амино</supplement_name>
      <supplement_price currency="лев">41.00</supplement_price>
      <supplement_rating>7</supplement_rating>
      <taste>лимон</taste>
      <packing measurement_unit="кг">1.000</packing>
      <servings>30 дози</servings>
    </supplement>
  </supplements>
  <sport_accessories>
    <boxing_gloves boxing_gloves_id="15" available_in_shop="N1">
      <boxing_gloves_model>ББС</boxing_gloves_model>
      <boxing_gloves_price currency="лев">55.00</boxing_gloves_price>
      <boxing_gloves_size>12 ОЗ</boxing_gloves_size>
      <boxing_gloves_rating>7</boxing_gloves_rating>
      <boxing_gloves_material>естествена кожа</boxing_gloves_material>
      <origin>Еверласт</origin>
    </boxing_gloves>
    <boxing_gloves boxing_gloves_id="16" available_in_shop="N1">
      <boxing_gloves_model>Аибо</boxing_gloves_model>
      <boxing_gloves_price currency="лев">74.00</boxing_gloves_price>
      <boxing_gloves_size>14 ОЗ</boxing_gloves_size>
      <boxing_gloves_rating>8</boxing_gloves_rating>
      <boxing_gloves_material>естествена кожа</boxing_gloves_material>
      <origin>Адидас</origin>
    </boxing_gloves>
    <sport_shoes sport_shoes_id="15" available_in_shop="N1">
      <shoes_model>Епик</shoes_model>
      <shoes_price currency="лев">84.00</shoes_price>
      <shoes_size>42</shoes_size>
      <shoes_color>бяли</shoes_color>
      <shoes_brand>Адидас</shoes_brand>
    </sport_shoes>
    <sport_shoes sport_shoes_id="16" available_in_shop="N1">
      <shoes_model>Епик елит</shoes_model>
      <shoes_price currency="лев">94.00</shoes_price>
      <shoes_size>39</shoes_size>
      <shoes_color>сини</shoes_color>
      <shoes_brand>Адидас</shoes_brand>
    </sport_shoes>
  </sport_accessories>
</sport_shop>
