<?xml version="1.0" encoding="UTF-8"?>
<!DOCTYPE sport_shop SYSTEM "sport_shop.dtd">
<sport_shop>
  <shop_info shop_id="N1">
    <shop_name>Сила</shop_name>
    <country>България</country>
    <city>София</city>
    <address>Георги С. Раковски 176</address>
    <phone>0876142563</phone>
    <email>sila@gmail.com</email>
    <site>www.sila.com</site>
  </shop_info>
  <supplements>
    <supplement supplement_id="9"  type="Гейнъри" purpose="Стимулира покачването на тегло"  supplement_brand="Гаспари" available_in_shop="N1">
      <supplement_name>Реал мас</supplement_name>
      <supplement_price currency="лев">135.00</supplement_price>
      <supplement_rating>8</supplement_rating>
      <taste>шоколад</taste>
      <packing measurement_unit="кг">5.000</packing>
      <servings>25 дози</servings>
    </supplement>
    <supplement supplement_id="10" type="Аминокиселини" purpose="Изгаряне на мазнини"  supplement_brand="Гаспари" available_in_shop="N1">
      <supplement_name>Амино макс</supplement_name>
      <supplement_price currency="лев">48.00</supplement_price>
      <supplement_rating>7</supplement_rating>
      <taste>лимон</taste>
      <packing measurement_unit="кг">0.450</packing>
      <servings>22 дози</servings>
    </supplement>
  </supplements>
  <sport_accessories>
    <boxing_gloves boxing_gloves_id="9" available_in_shop="N1">
      <boxing_gloves_model>Спорт</boxing_gloves_model>
      <boxing_gloves_price currency="лев">41.00</boxing_gloves_price>
      <boxing_gloves_size>14 ОЗ</boxing_gloves_size>
      <boxing_gloves_rating>6</boxing_gloves_rating>
      <boxing_gloves_material>изкуствена кожа</boxing_gloves_material>
      <origin>Еверласт</origin>
    </boxing_gloves>
    <boxing_gloves boxing_gloves_id="10" available_in_shop="N1">
      <boxing_gloves_model>Праид</boxing_gloves_model>
      <boxing_gloves_price currency="лев">58.00</boxing_gloves_price>
      <boxing_gloves_size>10 ОЗ</boxing_gloves_size>
      <boxing_gloves_rating>7</boxing_gloves_rating>
      <boxing_gloves_material>естествена кожа</boxing_gloves_material>
      <origin>Праид</origin>
    </boxing_gloves>
    <sport_shoes sport_shoes_id="9" available_in_shop="N1">
      <shoes_model>Нова</shoes_model>
      <shoes_price currency="лев">94.00</shoes_price>
      <shoes_size>44</shoes_size>
      <shoes_color>бяли</shoes_color>
      <shoes_brand>Адидас</shoes_brand>
    </sport_shoes>
    <sport_shoes sport_shoes_id="10" available_in_shop="N1">
      <shoes_model>Пецер</shoes_model>
      <shoes_price currency="лев">76.00</shoes_price>
      <shoes_size>45</shoes_size>
      <shoes_color>черни</shoes_color>
      <shoes_brand>Пума</shoes_brand>
    </sport_shoes>
  </sport_accessories>
</sport_shop>
