<?xml version="1.0" encoding="UTF-8"?>
<!DOCTYPE sport_shop SYSTEM "sport_shop.dtd">
<sport_shop>
  <shop_info shop_id="N1">
    <shop_name>Сила</shop_name>
    <country>България</country>
    <city>София</city>
    <address>Георги С. Раковски 176</address>
    <phone>0876142563</phone>
    <email>sila@gmail.com</email>
    <site>www.sila.com</site>
  </shop_info>
  <supplements>
    <supplement supplement_id="39"  type="Протеини" purpose="Изграждане на чисти мускули"  supplement_brand="Oптимум нутришън" available_in_shop="N1">
      <supplement_name>Ултра</supplement_name>
      <supplement_price currency="лев">95.00</supplement_price>
      <supplement_rating>6</supplement_rating>
      <taste>шоколад</taste>
      <packing measurement_unit="кг">2.225</packing>
      <servings>22 дози</servings>
    </supplement>
    <supplement supplement_id="40"  type="Гейнъри" purpose="Стимулира покачването на тегло"  supplement_brand="Биотеч" available_in_shop="N1">
      <supplement_name>Карбо-Х</supplement_name>
      <supplement_price currency="лев">95.00</supplement_price>
      <supplement_rating>8</supplement_rating>
      <taste>шоколад</taste>
      <packing measurement_unit="кг">5.450</packing>
      <servings>20 дози</servings>
    </supplement>
  </supplements>
  <sport_accessories>
    <boxing_gloves boxing_gloves_id="38" available_in_shop="N1">
      <boxing_gloves_model>Ерго про</boxing_gloves_model>
      <boxing_gloves_price currency="лев">75.00</boxing_gloves_price>
      <boxing_gloves_size>12 ОЗ</boxing_gloves_size>
      <boxing_gloves_rating>9</boxing_gloves_rating>
      <boxing_gloves_material>естествена кожа</boxing_gloves_material>
      <origin>Еверласт</origin>
    </boxing_gloves>
    <boxing_gloves boxing_gloves_id="39" available_in_shop="N1">
      <boxing_gloves_model>Аиба про</boxing_gloves_model>
      <boxing_gloves_price currency="лев">230.00</boxing_gloves_price>
      <boxing_gloves_size>12 ОЗ</boxing_gloves_size>
      <boxing_gloves_rating>10</boxing_gloves_rating>
      <boxing_gloves_material>естествена кожа</boxing_gloves_material>
      <origin>Адидас</origin>
    </boxing_gloves>
    <sport_shoes sport_shoes_id="38" available_in_shop="N1">
      <shoes_model>Дарт</shoes_model>
      <shoes_price currency="лев">86.00</shoes_price>
      <shoes_size>42</shoes_size>
      <shoes_color>сиви</shoes_color>
      <shoes_brand>Пума</shoes_brand>
    </sport_shoes>
    <sport_shoes sport_shoes_id="39" available_in_shop="N1">
      <shoes_model>Фалкон</shoes_model>
      <shoes_price currency="лев">96.00</shoes_price>
      <shoes_size>44</shoes_size>
      <shoes_color>червени</shoes_color>
      <shoes_brand>Адидас</shoes_brand>
    </sport_shoes>
  </sport_accessories>
</sport_shop>
