<?xml version="1.0" encoding="UTF-8"?>
<!DOCTYPE sport_shop SYSTEM "sport_shop.dtd">
<sport_shop>
  <shop_info shop_id="N1">
    <shop_name>Сила</shop_name>
    <country>България</country>
    <city>София</city>
    <address>Георги С. Раковски 176</address>
    <phone>0876142563</phone>
    <email>sila@gmail.com</email>
    <site>www.sila.com</site>
  </shop_info>
  <supplements>
    <supplement supplement_id="23"  type="Протеини" purpose="Изграждане на чисти мускули"  supplement_brand="Oптимум нутришън" available_in_shop="N1">
      <supplement_name>Нитро голд</supplement_name>
      <supplement_price currency="лев">102.00</supplement_price>
      <supplement_rating>9</supplement_rating>
      <taste>шоколад</taste>
      <packing measurement_unit="кг">2.225</packing>
      <servings>22 дози</servings>
    </supplement>
    <supplement supplement_id="24"  type="Гейнъри" purpose="Стимулира покачването на тегло"  supplement_brand="Универсал" available_in_shop="N1">
      <supplement_name>Ирон мас</supplement_name>
      <supplement_price currency="лев">78.00</supplement_price>
      <supplement_rating>6</supplement_rating>
      <taste>лимон</taste>
      <packing measurement_unit="кг">5.000</packing>
      <servings>20 дози</servings>
    </supplement>
  </supplements>
  <sport_accessories>
    <boxing_gloves boxing_gloves_id="22" available_in_shop="N1">
      <boxing_gloves_model>Траин</boxing_gloves_model>
      <boxing_gloves_price currency="лев">65.00</boxing_gloves_price>
      <boxing_gloves_size>12 ОЗ</boxing_gloves_size>
      <boxing_gloves_rating>7</boxing_gloves_rating>
      <boxing_gloves_material>естествена кожа</boxing_gloves_material>
      <origin>Еверласт</origin>
    </boxing_gloves>
    <boxing_gloves boxing_gloves_id="23" available_in_shop="N1">
      <boxing_gloves_model>Аибаспорт</boxing_gloves_model>
      <boxing_gloves_price currency="лев">80.00</boxing_gloves_price>
      <boxing_gloves_size>12 ОЗ</boxing_gloves_size>
      <boxing_gloves_rating>8</boxing_gloves_rating>
      <boxing_gloves_material>естествена кожа</boxing_gloves_material>
      <origin>Еверласт</origin>
    </boxing_gloves>
    <sport_shoes sport_shoes_id="22" available_in_shop="N1">
      <shoes_model>Бловед</shoes_model>
      <shoes_price currency="лев">84.00</shoes_price>
      <shoes_size>42</shoes_size>
      <shoes_color>черни</shoes_color>
      <shoes_brand>Адидас</shoes_brand>
    </sport_shoes>
    <sport_shoes sport_shoes_id="23" available_in_shop="N1">
      <shoes_model>Лите</shoes_model>
      <shoes_price currency="лев">94.00</shoes_price>
      <shoes_size>40</shoes_size>
      <shoes_color>сини</shoes_color>
      <shoes_brand>Пума</shoes_brand>
    </sport_shoes>
  </sport_accessories>
</sport_shop>
