<?xml version="1.0" encoding="UTF-8"?>
<!DOCTYPE sport_shop SYSTEM "sport_shop.dtd">
<sport_shop>
  <shop_info shop_id="N1">
    <shop_name>Сила</shop_name>
    <country>България</country>
    <city>София</city>
    <address>Георги С. Раковски 176</address>
    <phone>0876142563</phone>
    <email>sila@gmail.com</email>
    <site>www.sila.com</site>
  </shop_info>
  <supplements>
    <supplement supplement_id="33" type="Креатини" purpose="Увеличава издръжливостта"  supplement_brand="Амикс" available_in_shop="N1">
      <supplement_name>Креа трикс</supplement_name>
      <supplement_price currency="лев">53.00</supplement_price>
      <supplement_rating>6</supplement_rating>
      <taste>лимон</taste>
      <packing measurement_unit="кг">1.000</packing>
      <servings>50 дози</servings>
    </supplement>
    <supplement supplement_id="34"  type="Протеини" purpose="Изграждане на чисти мускули"  supplement_brand="Мекс" available_in_shop="N1">
      <supplement_name>Протеин изолат</supplement_name>
      <supplement_price currency="лев">45.00</supplement_price>
      <supplement_rating>8</supplement_rating>
      <taste>ванилия</taste>
      <packing measurement_unit="кг">1.000</packing>
      <servings>10 дози</servings>
    </supplement>
  </supplements>
  <sport_accessories>
    <boxing_gloves boxing_gloves_id="32" available_in_shop="N1">
      <boxing_gloves_model>Спортисимо</boxing_gloves_model>
      <boxing_gloves_price currency="лев">75.00</boxing_gloves_price>
      <boxing_gloves_size>12 ОЗ</boxing_gloves_size>
      <boxing_gloves_rating>9</boxing_gloves_rating>
      <boxing_gloves_material>естествена кожа</boxing_gloves_material>
      <origin>СЗ</origin>
    </boxing_gloves>
    <boxing_gloves boxing_gloves_id="33" available_in_shop="N1">
      <boxing_gloves_model>Спортпро</boxing_gloves_model>
      <boxing_gloves_price currency="лев">45.00</boxing_gloves_price>
      <boxing_gloves_size>16 ОЗ</boxing_gloves_size>
      <boxing_gloves_rating>6</boxing_gloves_rating>
      <boxing_gloves_material>изкуствена кожа</boxing_gloves_material>
      <origin>Праид</origin>
    </boxing_gloves>
    <sport_shoes sport_shoes_id="32" available_in_shop="N1">
      <shoes_model>Сурго</shoes_model>
      <shoes_price currency="лев">54.00</shoes_price>
      <shoes_size>40</shoes_size>
      <shoes_color>черни</shoes_color>
      <shoes_brand>Пума</shoes_brand>
    </sport_shoes>
    <sport_shoes sport_shoes_id="33" available_in_shop="N1">
      <shoes_model>Нарита</shoes_model>
      <shoes_price currency="лев">64.00</shoes_price>
      <shoes_size>44</shoes_size>
      <shoes_color>черни</shoes_color>
      <shoes_brand>Пума</shoes_brand>
    </sport_shoes>
  </sport_accessories>
</sport_shop>
